公司名称                     	 联系人    	 电话 {:<}     	 地址 {:<} 	
 深圳市星驿银联支付有限公司	     	黄先生	     	13500190754	     	广东 深圳
深圳市春树园信息技术有限公司	     	林经理	     	15019296313	     	广东 深圳
深圳前海卓越通讯有限公司	     	陈小姐	     	13530703609	     	广东 深圳
佛山际丰金属制品有限公司	     	潘经理	     	18027683242	     	广东 佛山
佛山市威尔信保险柜有限公司	     	关娟	     	18927210713	     	广东 佛山佛山南海九江沙头公司官网：www.weierxin.com
东莞漫果电子科技有限公司	     	黄小姐	     	18124334759	     	广东 东莞
深圳市精铭鑫雨伞制品有限公司	     	朱用华	     	13530081571	     	广东 深圳
深圳市荣风华文具有限公司	     	邱振荣	     	18025361716	     	广东 深圳
深圳市天宏智能科技有限公司	     	蔡易霖	     	15361626499	     	广东 深圳
广州办公家具有限公司	     	杨先生	     	13044229767	     	广东 广州
深圳即富数据处理有限公司	     	史桂雄	     	18682021056	     	广东 深圳
深圳市索美奇文具有限公司	     	郭剑雄	     	13682529240	     	广东 深圳深圳市龙华新区大浪英泰工业中心联华工业园6栋4楼
深圳市华宇恒丰科技有限公司	     	曾总	     	17713546515	     	广东 深圳
深圳市万历达家具有限公司	     	吴工	     	15899850085	     	广东 深圳南山区西丽街道大|一村
广州市三横信息科技有限公司	     	丁希	     	13808811093	     	广东 广州
中山市祥恒信息咨询有限公司	     	李天和	     	18125204179	     	广东 中山
深圳市鸿标电子科技有限公司	     	王波妮	     	13682411861	     	广东 深圳
东莞市富涵贸易有限公司	     	蔡秋平	     	13537195458	     	广东 东莞
中山市沃尚龙家具有限公司	     	陈屹	     	13631186858	     	广东 中山中山市神湾镇公司官网：www.woshanglongjj.com公司电话：0760-89810928
丁泉光明新建兴有限公司	     	薛先生	     	18520896246	     	广东 深圳
深圳辰兴支付信息技术有限公司	     	郑国梁	     	18719458184	     	广东 深圳深圳光明新区公明街道涛宇大厦702室公司官网：www.szcxzf.com公司电话：0755-23119022公司传真：0755-23119022
广州市永更科技有限公司	     	18302042798	     	18302042798	     	广东 佛山
珠海誉达天下商贸有限公司	     	郑嘉贤	     	17688198496	     	广东 珠海
东莞市旺利文具有限公司	     	汪小姐	     	18665080746	     	广东 东莞
深圳群索科技有限公司	     	田波	     	13267213759	     	广东 深圳
广东中都家具有限公司	     	黄锦丽	     	18688258860	     	广东 佛山
东莞市华唐文教用品有限公司	     	黄先生	     	13712120625	     	广东 东莞东莞市华唐文教用品有限公司公司官网：http://www.haxfo.com公司电话：0769-86717060公司传真：0769-89786075
