公司名称                     	 联系人    	 电话 {:<}     	 地址 {:<} 	
 广东订单有限公司	     	林李样	     	13286939708	     	广东 中山
深圳市众创有限公司	     	成白	     	13242433171	     	广东 深圳
阿伯丁园林绿化工程（广州）有限公司	     	杨小姐	     	18078827899	     	广东 广州广州市越秀区长堤大马路316号
广州千艺文联	     	汤先生	     	18011927481	     	广东 广州
广州缘义纸制品有限公司	     	曹小姐	     	13527652703	     	广东 广州
惠州大亚湾惠海塑胶制品有限公司	     	李小姐	     	13829929131	     	广东 惠州
东莞市魅涩智能科技有限公司	     	张玉	     	18682310882	     	广东 东莞
广州国拍文化传播有限公司司司	     	李小姐	     	13145923315	     	广东 广州
深圳雍乾盛世艺术品展览销售有限公司	     	冼健良	     	18018784350	     	广东 深圳
深圳乾龙国际文化传播公司	     	沈金波	     	18124757626	     	广东 深圳
东莞市科米模型科技有限公司	     	王竖量	     	18802519471	     	广东 东莞东莞市长安镇新安社区利成工业城公司官网：www.kemi888.com
深圳继承控股集团	     	继承人	     	15522622362	     	广东 深圳
广东艺贝玩具制品有限公司	     	刘先生2	     	18842602240	     	广东 广州
广州芯胜电子科技有限公司	     	李香	     	17620148885	     	广东 广州
山东省阿伟大全有限公司	     	很柔软	     	13823563669	     	广东 佛山
广州龙腾传媒有限公司	     	邓生	     	18675890333	     	广东 广州广州市越秀区环市东路334号市政中环大厦18楼
广东凹凸艺术	     	秦芳	     	13602372106	     	广东 东莞
深圳太古艺术品拍卖有限公司	     	陈经理	     	13510570322	     	广东 深圳
广东翠趣儿玉文化有限公司	     	冯小峰	     	13435812836	     	广东 佛山平洲玉器街宝翠路7号
深圳市江南园艺仿真植物有限公司	     	杨冰珠	     	17704047442	     	广东 深圳
广州春迪商贸发展有限公司	     	梁生	     	13826295766	     	广东 广州
深圳市光明新区光明东林雕塑厂	     	蒋雄林	     	15078920927	     	广东 深圳深圳市光明新区光明街道新羌社区羌下一路60号
深圳市沃客快充科技有限公司	     	范志标	     	15797656282	     	广东 深圳
广州艺术品鉴定机构	     	陈小姐	     	13926481881	     	广东 广州广州大道中泰兴大夏610
广州鉴藏艺术品服务公司	     	李生	     	13533531120	     	广东 广州广州市越秀区文德路东方文德广场A座2318公司官网：http://www.lnjb.tv/
东莞科品快速成型技术有限公司	     	陈文鑫	     	18922525462	     	广东 东莞东莞市长安镇沙头S358省道968号
深圳市欧凯伞业有限公司	     	刘小姐	     	18026994378	     	广东 深圳
