公司名称                     	 联系人    	 电话 {:<}     	 地址 {:<} 	
 惠州市惠城区新纪元文具批发行	     	戴增权	     	13542758487	     	广东 惠州公司电话：0752-1354275
深圳熙宝源兴鸿联科技有限公司	     	李小姐	     	18922852201	     	广东 深圳深圳公司电话：0755-86008500
深圳市摩拓触摸科技有限公司	     	洪先生	     	13922268624	     	广东 深圳深圳市光明新区甲子塘九洲工业园2栋4楼公司电话：0755-33985882-836
深圳市德义星实业有限公司	     	匡粤	     	13692261731	     	广东 深圳
微淘通电子商务（深圳）有限公司	     	微淘通	     	18807528944	     	广东 深圳世贸中心3201
广州车胜教学设备有限公司	     	陈美升	     	18607946570	     	广东 广州广州市白云区长红村第三经济合作社十五亩工业区B栋
广州爱哆米动漫科技有限公司	     	何花	     	18675970735	     	广东 广州
潮州市创佳集团有限公司	     	陈先生	     	13823430414	     	广东 潮州广东省潮州市湘桥区新洋路中段
深圳艾猫科技集团	     	吴小姐	     	13682605950	     	广东 深圳
广州领阳灯光科技有限公司	     	谢小姐	     	13316084496	     	广东 广州公司电话：020-86401022
广东贝尔康幼教设施有限公司	     	张先生	     	13680771513	     	广东 惠州
深圳市中广控信息科技有限公司	     	陈鹏	     	13828757072	     	广东 深圳
深圳市湘涛教育设备科技有限公司	     	田先生	     	15306355370	     	广东 深圳宝安区西乡臣田工业区25栋公司官网：www.xiangtaokeji.com
深圳市爱嘟嘟儿童游乐设备	     	罗成洋	     	13632739552	     	广东 深圳
深圳市爱嘟嘟儿童游乐有限公司	     	卢辉	     	18359005400	     	广东 深圳
广州仁河动漫科技有限公司	     	陈恩德	     	13826292232	     	广东 广州
广州番禺九崇动漫科技有限公司	     	邓先生	     	13530726174	     	广东 广州
深圳市风谷信息技术有限公司	     	刘燕平	     	18565838262	     	广东 深圳
75482602816	     	王坚	     	称：汕头市通新塑料有限公司	     	广东 汕头中国广东汕头市潮阳区和平镇新和桥尾师范学校东侧公司电话：8675482602816公司传真：075482601816
深圳特乐投影科技有限公司	     	柳生	     	13715003940	     	广东 深圳中国广东深圳市宝安区深圳宝安福永镇富源工业区公司电话：8675529220715公司传真：0755-29588894
076986902200809	     	李富美	     	称：东莞樟木头汇全电子工具商行	     	广东 东莞中国广东东莞市樟木头电子城2A121122号公司电话：86076986902200809公司传真：076987137882
触摸屏一级代理代理深圳鸿怡威自动化技术有限公司	     	闫小姐	     	15018504032	     	广东 深圳中国广东深圳市宝安区深圳市宝安区松岗...EVIEW触摸屏总代理公司电话：86075527710709公司传真：075527469577
深圳市鑫润钢具有限公司	     	黄美年	     	18929342682	     	广东 深圳中国广东深圳市南山区深圳市南山区西丽公司电话：086075526729692公司传真：075526729692
广州友效力贸易有限公司	     	戴恒艺	     	13512700116	     	广东 广州中国广东广州市越秀区海珠南路218-222号濠畔商厦1601...公司电话：020-81868395公司传真：020-81849415
新异投影科技有限公司	     	王云玲	     	13925206453	     	广东 深圳中国广东深圳市福田区深圳市福田区华强南路华强电子世...公司电话：86075583631367公司传真：075583625529
深圳市尖科达光电有限公司	     	张杨	     	18926487159	     	广东 深圳中国广东深圳市龙岗区坂田河背钟泰大厦二楼公司电话：86075584198313公司传真：075584198313
75527345605234	     	岳小姐	     	称：白雪投影显示技术有限公司	     	广东 深圳中国广东深圳市宝安区福永第四工业区公司电话：8675527345605234公司传真：075527345740
